{
  "schema_version": 1,
  "subject_id": "synthetic-metric-demo",
  "window": {
    "start_ns": "0",
    "end_ns": "1000000000"
  },
  "strokes": [
    {
      "id": "p1",
      "target_id": "neutral-target",
      "axis": "stroke",
      "start_ns": "200000000",
      "end_ns": "500000000",
      "start_position_ppm": 200000,
      "end_position_ppm": 700000
    }
  ],
  "flags": []
}
